{"$schema":"https://json-schema.org/draft/2020-12/schema","title":"VSN Runtime Catalog v1","type":"object","required":["schema_version","provider","runtimes"],"additionalProperties":false,"properties":{"schema_version":{"const":1},"provider":{"type":"string","minLength":1,"maxLength":128},"runtimes":{"type":"array","items":{"type":"object","required":["runtime","version","artifacts"],"additionalProperties":false,"properties":{"runtime":{"type":"string","pattern":"^[a-z0-9_-]{1,64}$"},"version":{"type":"string","pattern":"^[A-Za-z0-9._+\\-]{1,64}$"},"artifacts":{"type":"array","minItems":1,"items":{"type":"object","required":["os","arch","url","sha256","archive","executable_relpath"],"additionalProperties":false,"properties":{"os":{"type":"string"},"arch":{"type":"string"},"url":{"type":"string","pattern":"^(https://|file://)"},"sha256":{"type":"string","pattern":"^[A-Fa-f0-9]{64}$"},"archive":{"enum":["zip","tar.gz","tgz","tar.xz","tar","binary"]},"executable_relpath":{"type":"string","minLength":1}}}}}}},"signature":{"type":["string","null"]}}}
