{
  "schema_version": 1,
  "provider": "example-only",
  "runtimes": [
    {
      "runtime": "php",
      "version": "8.4.0",
      "artifacts": [
        {
          "os": "windows",
          "arch": "x86_64",
          "url": "file:///C:/VSN/provider-cache/php-8.4.0.zip",
          "sha256": "0000000000000000000000000000000000000000000000000000000000000000",
          "archive": "zip",
          "executable_relpath": "php.exe"
        }
      ]
    }
  ],
  "signature": null
}
